{
  "schemaVersion": "1.0.0",
  "title": "South Aero adversarial input test design",
  "language": "th",
  "generatedAt": "2026-09-24",
  "evidence": {
    "commit": "8d4101a",
    "basis": "Static inspection of working tree, including pre-existing uncommitted edits. No runtime security tests executed.",
    "nextDeclared": "15.5.24",
    "scopeChange": "2026-09-25: Coupon deferred by customer instruction; N-26/N-27 removed from active scope (not passing tests). Inventory delta bound to Admin action and shared command."
  },
  "semantics": {
    "purpose": "Recommended target contract, not a report of passing behavior.",
    "expansion": "One test per case × target × value/recipe variant, always reset a valid fixture first. Never combine invalid mutations except explicitly named sequences.",
    "http": "expected.httpStatus is keyed by target. Route handlers use real HTTP statuses. Normal handled Server Action failures use wire 200 plus success:false and semanticStatus; do not assert wire 422 on RSC. null means no HTTP boundary (unit only).",
    "integration": "Adapters must expose raw response, normalized result, DB diff and provider/sink counts. Unit calls do not prove HTTP auth. Capture native Server Action requests via the current build; never invent action IDs or REST URLs.",
    "gaps": "proposed_contract/adapter_required are future requirements, not existing features. A mismatch on an existing surface is FAIL; absent surface is UNIMPLEMENTED, never PASS or silently SKIP.",
    "errorEnvelope": {
      "success": false,
      "error": {
        "code": "INVALID_INPUT",
        "message": "Invalid request",
        "requestId": "<opaque>"
      }
    },
    "errors": {
      "400": [
        "BAD_REQUEST",
        "Invalid request"
      ],
      "401": [
        "UNAUTHENTICATED",
        "Authentication required"
      ],
      "403": [
        "FORBIDDEN",
        "Request not permitted"
      ],
      "404": [
        "NOT_FOUND",
        "Resource not found"
      ],
      "409": [
        "CONFLICT",
        "Request conflicts with current state"
      ],
      "413": [
        "PAYLOAD_TOO_LARGE",
        "Request too large"
      ],
      "415": [
        "UNSUPPORTED_MEDIA_TYPE",
        "Unsupported content type"
      ],
      "422": [
        "INVALID_INPUT",
        "Invalid request"
      ],
      "429": [
        "RATE_LIMITED",
        "Too many requests"
      ],
      "500": [
        "INTERNAL_ERROR",
        "Unable to process request"
      ],
      "503": [
        "TEMPORARILY_UNAVAILABLE",
        "Please retry later"
      ]
    },
    "precedence": "Use valid auth and baseline below limits for input tests. Transport/body limits may reject first. For auth tests use otherwise valid bodies. For signed webhook structure tests sign the malformed raw bytes correctly so signature failure cannot mask schema failure.",
    "safety": "Design only. Before side effects: explicit isolated DB allowlist and scoped credentials, Stripe test account/key, Clerk test users, Resend email sink, per-run fixtures/cleanup; guard must precede imports that initialize providers. No .env dump, production requests or broad load test.",
    "metrics": "Record monotonic duration, peak worker RSS, bytes received, rows changed, outbound calls. Resource cases run serially, hard timeout 5000ms and isolated worker watchdog 256MiB growth budget (proposed test budgets, calibrate to baseline).",
    "oversizedNativeActionRevision": {
      "date": "2026-09-28",
      "authorization": "Owner approved HTTP 413 for oversized requests in this chat. Actual streamed UTF-8 body bytes are capped before React decoding; multipart retains 4 MiB. No variants or security invariants removed.",
      "previousCorpus": "../handoff/2026-09-28/before-ingress-corpus.json"
    }
  },
  "limits": {
    "cartQuantityMax": 10,
    "checkoutQuantityMax": 100,
    "checkoutItemsMax": 100,
    "amountMinSatang": 1,
    "amountMaxSatang": 99999999,
    "stockMax": 2147483647,
    "deltaAbsMax": 2147483647,
    "priceMaxMajor": "9999999999.99",
    "skuMaxCodePoints": 100,
    "nameMaxCodePoints": 255,
    "descriptionMaxUtf8Bytes": 16384,
    "noteMaxUtf8Bytes": 2048,
    "jsonMaxDepth": 32,
    "apiBodyMaxBytes": 1048576,
    "stripeBodyMaxBytes": 1048576,
    "actionBodyMaxBytes": 4194304,
    "guestTokenHexLength": 64,
    "guestTokenTtlSeconds": 604800,
    "stripePastToleranceSeconds": 300,
    "stripeFutureSkewSeconds": 30,
    "provenance": "Cart/checkout limits, DB int/numeric types, webhook 1MiB and action 4mb are from code. Other field/depth/amount/future-skew/guest-expiry policies are proposed; amountMax is a merchant cap, not a universal provider limit. Payment-method minimum/maximum require account-specific fixtures.",
    "actionJsonBodyMaxBytes": 1000000
  },
  "targets": {
    "cart.add": {
      "transport": "server_action",
      "binding": "apps/storefront/actions/cart.actions.ts#addToCart",
      "actor": "customer",
      "fixture": "cart",
      "notes": "Action currently validates but does not persist a cart."
    },
    "checkout.create": {
      "transport": "server_action",
      "binding": "apps/storefront/actions/checkout.actions.ts#createOrder",
      "actor": "customer",
      "fixture": "checkout",
      "notes": "No public amount/currency fields; prices calculated from DB."
    },
    "guest.track": {
      "transport": "server_action",
      "binding": "apps/storefront/actions/checkout.actions.ts#getOrderDetails and getOrderStatus",
      "actor": "guest",
      "fixture": "guest",
      "notes": "Run each case against both actions; normalized argument object maps to positional args. Clear ambient cookies for token tests."
    },
    "admin.product": {
      "transport": "server_action",
      "binding": "apps/admin/actions/product.actions.ts#createProductAction and updateProductAction",
      "actor": "authorized_admin",
      "fixture": "product",
      "notes": "Run both create and update when applicable; update ID passed separately. DB price is decimal string, stockQuantity absolute."
    },
    "inventory.delta": {
      "transport": "server_action",
      "binding": "apps/admin/actions/inventory.actions.ts#adjustInventoryAction",
      "actor": "authorized_admin",
      "fixture": "inventory",
      "notes": "Admin/super_admin only. Shared command has service_unit fixture coverage; PostgreSQL transaction and native HTTP remain separate evidence requirements."
    },
    "amount.validate": {
      "transport": "unit",
      "binding": null,
      "actor": "internal",
      "fixture": "amount",
      "notes": "Proposed finite safe integer satang validator. Test conversion separately; current toSmallestCurrencyUnit takes major units."
    },
    "api.json": {
      "transport": "contract_route",
      "binding": null,
      "actor": "customer",
      "fixture": "generic",
      "notes": "Abstract hardened JSON request contract; bind only to an actual JSON endpoint or an isolated test adapter."
    },
    "stripe.webhook": {
      "transport": "route_handler",
      "binding": "POST /api/webhooks/stripe",
      "actor": "stripe_test_signer",
      "fixture": "stripe",
      "notes": "Use actual raw-body signature verification, not a mocked constructEvent."
    },
    "money.convert": {
      "transport": "unit",
      "binding": "packages/lib/src/stripe.ts#toSmallestCurrencyUnit",
      "actor": "internal",
      "fixture": "majorMoney",
      "notes": "Proposed strict decimal-major-unit contract for existing converter."
    }
  },
  "fixtures": {
    "cart": {
      "input": {
        "productId": "10000000-0000-4000-8000-000000000001",
        "quantity": 1
      },
      "stock": 1000
    },
    "checkout": {
      "input": {
        "shippingAddress": {
          "recipientName": "QA Tester",
          "phone": "0812345678",
          "email": "qa@example.invalid",
          "line1": "1 Test Road",
          "subDistrict": "Test",
          "district": "Test",
          "province": "Bangkok",
          "postalCode": "10110"
        },
        "items": [
          {
            "productId": "10000000-0000-4000-8000-000000000001",
            "productName": "QA Product",
            "quantity": 1,
            "unitPrice": "100.00"
          }
        ],
        "shippingMethod": "standard",
        "paymentMethod": "promptpay",
        "saveAddress": false
      },
      "dbProduct": {
        "price": "100.00",
        "stockQuantity": 1000,
        "status": "active"
      },
      "notes": "Fresh product/order per test. Price expected from server DB plus actual shipping/tax/discount rules, using BigInt decimal oracle."
    },
    "guest": {
      "input": {
        "orderId": "20000000-0000-4000-8000-000000000002",
        "guestToken": "<mint from isolated secret>"
      },
      "userId": "guest_qa",
      "createdAt": "2026-09-24T00:00:00Z",
      "now": "2026-09-24T00:00:01Z",
      "notes": "Token = HMAC-SHA256 UTF8 guest_order:orderId:userId:createdAt -> lowercase hex. Never use this placeholder as a valid token. Separate order B and customer B. Cookie maxAge does not enforce server token expiry."
    },
    "product": {
      "input": {
        "sku": "QA-SKU-001",
        "name": "QA Product",
        "price": "100.00",
        "stockQuantity": 100,
        "status": "draft",
        "description": "QA description"
      },
      "notes": "Generate unique SKU for each accepted variant; use seeded duplicate only in conflict test. Exclude uploads."
    },
    "inventory": {
      "input": {
        "productId": "10000000-0000-4000-8000-000000000001",
        "delta": -1
      },
      "stockBefore": 100000
    },
    "amount": {
      "input": {
        "amountSatang": 10000,
        "currency": "thb"
      }
    },
    "generic": {
      "input": {
        "quantity": 1,
        "label": "QA"
      },